{
  "schema_version": "2.0",
  "action_id": "3f0c2a9e-5b1d-4c7a-9a52-0d6e1f8b7c11",
  "action_class": "email_bulk",
  "tool": "send_email",
  "actor": "agent-sales-01",
  "args": { "subject": "Última oportunidad: cupos agotándose", "body": "Texto sintético de ejemplo." },
  "recipients": ["persona001@ejemplo.test", "persona002@ejemplo.test"],
  "payload": { "subject": "Última oportunidad: cupos agotándose", "body": "Texto sintético de ejemplo." },
  "risk_level": "low",
  "dry_run": false,
  "created_at": "2026-10-17T15:00:00Z"
}
